{
  "apiVersion": "marshal.operator/v1alpha1",
  "kind": "TranscriptAttestationPreflight",
  "subject": {
    "sourceHead": "1eb476f7e323fe590534b7ee8b533f077424db2d",
    "taskId": "TA-POSITIVE",
    "runId": "ta-positive-r1",
    "attemptId": "attempt:positive",
    "adapterId": "qoder",
    "binaryVersion": "1.1.23",
    "protocolVersion": "1.2.0",
    "eventContract": "qoder-stream-json-1.2.0-v7",
    "permissionMode": "acceptEdits"
  },
  "inputs": {
    "transcript": {"path": "transcript-positive.jsonl", "sha256": "sha256:f7c93725655e3e98ba86285613236e4ece107fb7ae2ecd1e9add2ab42c80f978", "maxBytes": 8388608},
    "transcriptMeta": {"path": "transcript-positive-meta.json", "sha256": "sha256:63fc54037defc5f7535a041c39851f9ff4a476586d3c257c89352ac211db2608", "maxBytes": 131072},
    "workerResult": {"path": "worker-result.json", "sha256": "sha256:b95ab6fcb07f57d83e3f83755837921b7cbf15d5baae27847243b50a04cdd0d3", "maxBytes": 262144},
    "workerRequest": {"path": "worker-request.json", "sha256": "sha256:fbbca62c7fa39deb7fbb975ab5d8a1da2ffd26d732f13e4fecc05e28a0047c21", "maxBytes": 524288},
    "taskSpec": {"path": "task-spec.json", "sha256": "sha256:40ee788815a8e696b7c748d3da734125c88302ec5a6579bebe8448f27627938a", "maxBytes": 2097152},
    "capabilitySnapshot": {"path": "capability-snapshot.json", "sha256": "sha256:ff95c3b33907afcdc8b3033503a0baea8277322f35fa848ab129181f9345c7f8", "maxBytes": 524288},
    "profile": {"path": "transcript-attestation-profile.json", "sha256": "sha256:83ae31b68d9eb6f7a92dde05b62c4f786da4835aaa8461e50193ecbbb53dc54f", "maxBytes": 262144}
  }
}
